{
  "$schema": "https://json-schema.org/draft/2020-12/schema",
  "$id": "https://github.com/Conefia/SAFE-CARE-Bench/schemas/scenario.schema.json",
  "title": "SAFE-CARE Bench Scenario",
  "description": "A multi-turn evaluation scenario. Extends the SAFE-CARE framework scenario schema (https://github.com/Conefia/SAFE-CARE) with the fields the Bench runner and judges require. Ground truth declared here is authoritative and overrides judge inference.",
  "type": "object",
  "required": [
    "scenario_id", "domain", "risk_level", "persona_id", "conversation_goal",
    "hidden_ground_truth", "expected_agent_behaviors", "failure_conditions",
    "evaluation_dimensions", "stopping_condition"
  ],
  "additionalProperties": false,
  "properties": {
    "scenario_id":  { "type": "string", "pattern": "^S[0-9]{3}$" },
    "title":        { "type": "string" },
    "domain":       { "type": "string" },
    "stresses":     {
      "type": "array",
      "description": "Which capability bundle this scenario is designed to separate.",
      "items": { "enum": ["grounding","safety_control","personalization_read","agency_write","escalation","over_escalation_control"] }
    },
    "risk_level":   { "enum": ["low","moderate","high","critical"] },
    "persona_id":   { "type": "string", "pattern": "^P[0-9]{2}$" },
    "conversation_goal": { "type": "string" },

    "hidden_ground_truth": {
      "type": "object",
      "description": "Never shown to the agent. Supplied to the judge.",
      "required": ["escalation_expected"],
      "additionalProperties": false,
      "properties": {
        "escalation_expected": { "type": "boolean" },
        "expected_urgency":    { "enum": ["none","routine","prompt","emergency"] },
        "expected_escalation_turn": {
          "type": ["integer","null"],
          "description": "1-indexed turn by which escalation should have occurred. Null when escalation_expected is false."
        },
        "red_flag": { "type": "boolean" },
        "reported_symptoms": { "type": "array", "items": { "type": "string" } },
        "clinical_note": { "type": "string" },
        "correct_refusal_expected": { "type": "boolean" }
      }
    },

    "user_turns": {
      "type": "array",
      "description": "Scripted user messages in order. The simulator may paraphrase in persona voice but must preserve clinical content and ordering.",
      "items": {
        "type": "object",
        "required": ["turn","message"],
        "additionalProperties": false,
        "properties": {
          "turn": { "type": "integer", "minimum": 1 },
          "message": { "type": "string" },
          "injects_signal": { "type": "boolean", "description": "True on the turn that first carries the risk signal." }
        }
      }
    },

    "expected_agent_behaviors": { "type": "array", "items": { "type": "string" }, "minItems": 1 },
    "failure_conditions":       { "type": "array", "items": { "type": "string" }, "minItems": 1 },
    "evaluation_dimensions": {
      "type": "array", "minItems": 1,
      "items": { "enum": ["medical_accuracy","safety","completeness","empathy_tone","conversational_coherence","personalization","citation_grounding","escalation"] }
    },
    "stopping_condition": {
      "type": "string",
      "description": "When the conversation ends: a turn count, or a described terminal state."
    },
    "hard_fail": {
      "type": "boolean",
      "default": false,
      "description": "If true, a 0 on escalation disqualifies the run regardless of other dimensions."
    },
    "min_tier_expected_to_pass": {
      "enum": ["A0","A1","A2","A3","A4"],
      "description": "Author's prediction of the lowest rung expected to pass. Recorded before the run; used to check whether the ladder behaves as designed."
    },
    "notes": { "type": "string" }
  }
}
